{
  "$schema": "https://json-schema.org/draft/2020-12/schema",
  "$id": "https://github.com/blamejs/blamejs.shop/scripts/release-notes-schema.json",
  "title": "Release notes — structured source",
  "description": "Per-release source of truth at release-notes/v<X>.<Y>.<Z>.json. The generator validates every field against this schema PLUS a leak-vocabulary sweep before emitting markdown (single-line CHANGELOG.md entry OR multi-section release-page markdown).",
  "type": "object",
  "additionalProperties": false,
  "required": ["version", "date", "headline", "sections"],
  "properties": {
    "$schema": {
      "type": "string",
      "description": "Optional pointer to this schema file. Lets editors validate the JSON inline."
    },
    "version": {
      "type": "string",
      "pattern": "^\\d+\\.\\d+\\.\\d+$",
      "description": "Strict semver (digits + dots, no `v` prefix). Matches the file's basename (vX.Y.Z.json)."
    },
    "date": {
      "type": "string",
      "pattern": "^\\d{4}-\\d{2}-\\d{2}$",
      "description": "Release date (YYYY-MM-DD)."
    },
    "headline": {
      "type": "string",
      "minLength": 8,
      "description": "Single-line summary. No trailing punctuation. Starts with capital letter or backtick. Operator-facing — leak-vocabulary sweep rejects phase / sweep / tier / batch / group / slice numbering and AI-tooling names."
    },
    "summary": {
      "type": "string",
      "description": "Optional. 1-3 sentences expanding the headline. Ends with sentence punctuation."
    },
    "sections": {
      "type": "array",
      "minItems": 1,
      "items": { "$ref": "#/$defs/section" }
    },
    "references": {
      "type": "array",
      "items": { "$ref": "#/$defs/reference" }
    }
  },
  "$defs": {
    "section": {
      "type": "object",
      "additionalProperties": false,
      "required": ["heading", "items"],
      "properties": {
        "heading": {
          "type": "string",
          "enum": ["Added", "Changed", "Deprecated", "Removed", "Fixed", "Security", "Detectors", "Migration"]
        },
        "items": {
          "type": "array",
          "minItems": 1,
          "items": { "$ref": "#/$defs/item" }
        }
      }
    },
    "item": {
      "type": "object",
      "additionalProperties": false,
      "required": ["title", "body"],
      "properties": {
        "title": {
          "type": "string",
          "minLength": 1,
          "description": "Short item title. No trailing punctuation. Starts with letter or backtick."
        },
        "body": {
          "type": "string",
          "minLength": 16,
          "description": "Explanatory prose for the item. Ends with sentence punctuation."
        }
      }
    },
    "reference": {
      "type": "object",
      "additionalProperties": false,
      "required": ["label", "url"],
      "properties": {
        "label": { "type": "string", "minLength": 1 },
        "url":   { "type": "string", "pattern": "^https://" }
      }
    }
  }
}
