{
  "$schema": "../scripts/release-notes-schema.json",
  "version": "0.4.123",
  "date": "2026-06-26",
  "headline": "Vendored framework refreshed to 0.15.33",
  "summary": "Updates the vendored blamejs framework to 0.15.33. The upstream release is internal test-suite tooling only: it re-verifies three more of the framework's guard-suite suppression classes from scratch and renames their markers to descriptive tokens, recording the old names as retired so a re-verified class cannot inherit a stale approval. No runtime code, public API, or wire format changed upstream, so there is no runtime or behavior change for this storefront and no operator action is required.",
  "sections": [
    {
      "heading": "Changed",
      "items": [
        {
          "title": "Vendored framework refreshed to 0.15.33",
          "body": "Refreshes the vendored blamejs framework to 0.15.33, an upstream release scoped to test-suite tooling — three more guard-suite suppression classes re-verified and their markers renamed to descriptive tokens, with the old names retired. The shipped framework runtime, public API, and wire format are unchanged, so no operator action is required."
        }
      ]
    }
  ]
}
