{
  "$schema": "../scripts/release-notes-schema.json",
  "version": "0.0.88",
  "date": "2026-05-23",
  "headline": "Four more codebase-patterns ports + scanner `requires` field support + vendor v0.12.9",
  "summary": "The codebase-patterns scanner gains a `requires` field that exempts a primary regex hit when a paired bounding opt appears anywhere in the same file (e.g. `zlib.gunzipSync(...)` paired with `maxOutputLength: <const>`). Four more detector ports follow from blamejs's catalog: `gunzip-without-output-size-cap` (zip-bomb decompression cap), `audit-action-with-hyphen` (validator-refused hyphen segments), `non-canonical-audit-outcome` (only `success` / `failure` / `denied` pass the strict validator), `wildcard-suffix-match-without-single-label-check` (DNS wildcard `*.example.com` must refuse single-label matches per RFC 6125 §6.4.3). Vendor refresh to v0.12.9.",
  "sections": [
    {
      "heading": "Added",
      "items": [
        { "title": "Scanner `requires` field — secondary whole-file check exempts a primary hit when paired with a documented opt", "body": "`_check` now reads an optional `requires` regex on each detector entry. When set, a primary hit is exempted only if the same file's contents match `requires` somewhere. The companion check covers patterns where the call shape is correct ONLY when paired with a bounding option elsewhere (e.g. `zlib.gunzipSync(buf)` paired with `maxOutputLength: <byte-constant>`). Ported from blamejs's catalog convention." },
        { "title": "Four new ported detectors", "body": "`gunzip-without-output-size-cap` (DoS via decompression-bomb amplification; require `maxOutputLength` on every `zlib.gunzipSync` / `createGunzip` / brotli-decompress); `audit-action-with-hyphen` (action segments with `-` fail the `[a-z][a-z0-9_]*` validator — use snake_case); `non-canonical-audit-outcome` (only `success` / `failure` / `denied` pass `audit.record()`; `ok` / `fail` / `error` / etc. are silently normalized by `safeEmit` but the canonical strings belong at the call site); `wildcard-suffix-match-without-single-label-check` (RFC 6125 §6.4.3 — a `*.example.com` wildcard covers exactly one label, never zero / single-label). Detector count goes 30 → 34." }
      ]
    },
    {
      "heading": "Changed",
      "items": [
        { "title": "Vendored blamejs refreshed from v0.12.8 to v0.12.9", "body": "`bash scripts/vendor-update.sh blamejs v0.12.9` ran cleanly; `lib/vendor/blamejs/MANIFEST.json` updated. See `lib/vendor/blamejs/CHANGELOG.md` for the upstream surface changes between v0.12.8 and v0.12.9." },
        { "title": "`lib/customer-import.js` per-row error outcome string carries an inline allow marker", "body": "The detector flagged `outcome: \"error\"` on a per-row import-result object in `lib/customer-import.js:271`. Inspection confirmed it's a per-row operator-facing result, NOT an `audit.emit` payload — different vocabulary. Added an inline `// allow:non-canonical-audit-outcome — per-row operator-facing import result; not an audit.emit outcome` marker documenting the exception in place. The non-canonical-audit-outcome detector still fires on any real `audit.emit({outcome: \"error\"})` call." }
      ]
    }
  ]
}
