{
  "$schema": "../scripts/release-notes-schema.json",
  "version": "0.3.55",
  "date": "2026-06-02",
  "headline": "Accessibility: field-level form-error messages and horizontally scrollable admin tables",
  "summary": "Two accessibility improvements. When a storefront form is rejected, the specific field at fault is now marked for assistive technology with an inline error message tied to that input, in addition to the existing summary at the top of the form. And wide tables in the admin console now scroll horizontally inside their own container instead of overflowing the page on a narrow or zoomed viewport.",
  "sections": [
    {
      "heading": "Fixed",
      "items": [
        {
          "title": "Field-level error messages on storefront forms",
          "body": "When the address, review, product-question, or support-ticket form is rejected, the offending field is now marked aria-invalid with an inline error message associated to it (aria-describedby), so a screen-reader user is taken to the exact field to fix rather than only hearing a top-of-form summary. The server remains the only validator; this only changes how a rejected field is presented. Forms that fail on a whole-form condition continue to show the summary message."
        },
        {
          "title": "Admin tables reflow on narrow screens",
          "body": "Wide data tables in the admin console (orders, products, inventory, and the rest) are now wrapped in a horizontal-scroll container, so columns stay reachable on a smaller laptop window, a split screen, or at high zoom instead of overflowing the layout. Column header semantics are preserved."
        }
      ]
    }
  ]
}
