{
  "$schema": "../scripts/release-notes-schema.json",
  "version": "0.4.80",
  "date": "2026-06-21",
  "headline": "Recording an affiliate commission is idempotent under concurrency",
  "summary": "Recording an affiliate commission for an order now converges instead of failing when two attribution hooks fire for the same order at once. The recorder already returned the existing commission on a sequential repeat; under concurrency, both callers passed that pre-read and the second insert hit the (order_id, affiliate_id) uniqueness constraint and threw an unhandled error. The losing writer now catches the constraint violation and returns the committed row, so exactly one commission is recorded and both callers get it. No configuration changes; upgrade to pick it up.",
  "sections": [
    {
      "heading": "Fixed",
      "items": [
        {
          "title": "Concurrent affiliate-commission recording converges on one row",
          "body": "recordCommissionEvent wraps its insert so that when a concurrent call for the same (order_id, affiliate_id) wins the race, the losing writer catches the uniqueness violation and returns the already-committed commission rather than throwing. The sequential idempotent behaviour is unchanged; this closes the gap where two simultaneous attribution events for one order surfaced an unhandled error instead of a single recorded commission."
        }
      ]
    }
  ]
}
