{
  "$schema": "../scripts/release-notes-schema.json",
  "version": "0.0.97",
  "date": "2026-05-23",
  "headline": "Guest `/cart` on the edge + emergency fix for stray detector-injection leftover that broke wrangler bundling on v0.0.95",
  "summary": "v0.0.95 shipped with a one-line leftover at the bottom of `worker/index.js` — a stray `function _testCatchReturnNull() {` from an earlier detector-verification injection that wasn't fully cleaned up. `node --check` accepted the unterminated declaration but wrangler's esbuild refused with `Unexpected end of file`, blocking the v0.0.95 auto-deploy on Cloudflare Workers Builds. This patch removes the leftover and ships v0.0.96's guest-`/cart` edge route at the same time. The release-notes/v0.0.96.json file lands in this ship too (PR #96 was closed in favour of this consolidated release).",
  "sections": [
    {
      "heading": "Fixed",
      "items": [
        { "title": "Stray `function _testCatchReturnNull() {` removed from `worker/index.js`", "body": "A detector-verification injection that should have been fully reverted left a single unterminated `function` declaration at EOF. Node's parser tolerates the shape (`node --check` returned OK) but wrangler's esbuild reports `Unexpected end of file` and refuses to build, blocking the v0.0.95 Cloudflare Workers Builds deploy. The leftover is gone." }
      ]
    },
    {
      "heading": "Added",
      "items": [
        { "title": "Guest `/cart` rendered at the edge (carried from the closed PR #96)", "body": "GET `/cart` for visitors without a `shop_sid` / `shop_auth` cookie now renders the empty-cart page directly at the edge — same `worker/render/cart.js#renderCart` that ships in the Worker bundle, called with `lines: []` and zero totals. Cookie-bearing visitors fall through to the container path which has the framework's vault keychain and can decrypt the sealed session to look up the real cart row. Session-cookie detection reuses `_hasSessionCookie` — same predicate that's gated the edge cache since v0.0.78." }
      ]
    }
  ]
}
