{
  "$schema": "../scripts/release-notes-schema.json",
  "version": "0.4.121",
  "date": "2026-06-26",
  "headline": "Vendor-invoice reconciliation values each PO line at its own cost, and a vendor's invoices must share one currency",
  "summary": "Two fixes to vendor-invoice reconciliation and reporting. When the same SKU appeared on more than one purchase order at different unit costs, reconcileAgainstPOs summed the received quantity across the POs but valued all of it at the LAST PO's unit cost, inflating the PO received value and corrupting the over-billing variance the operator relies on to catch a vendor over-bill before paying. Each PO line is now valued at its own unit cost and accumulated, so the received value and the variance are exact, and the per-unit figure shown in the line variance is a true weighted mean. Separately, a vendor's invoices may now only be recorded in one currency: the accounts-payable aging report and the vendor scorecard sum amounts per vendor into a single figure, which is meaningless across currencies, so an invoice whose currency differs from the vendor's existing invoices is refused at write time rather than silently producing an incommensurable total.",
  "sections": [
    {
      "heading": "Fixed",
      "items": [
        {
          "title": "PO reconciliation values each purchase-order line at its own unit cost",
          "body": "reconcileAgainstPOs aggregated purchase-order lines per SKU, accumulating the received quantity across POs but overwriting the unit cost with each successive PO's — so when the same SKU was received on two POs at different prices, the received value was computed as the combined quantity times the last PO's cost. That inflated po_received_value_minor and the variance the operator uses to spot a vendor over-bill before payment. Each PO line is now valued at its own unit cost and the values accumulated, so the received value and variance are exact; the line-variance's per-unit cost is reported as the true weighted mean of the received value."
        },
        {
          "title": "A vendor's invoices must all be recorded in the same currency",
          "body": "The accounts-payable aging report and the vendor scorecard sum each vendor's invoice amounts into a single figure, which is only meaningful within one currency — mixing currencies produced an incommensurable total with no currency tag to unwind it. Recording an invoice whose currency differs from the vendor's existing invoices is now refused with a clear error, so those per-vendor totals stay within a single currency by construction."
        }
      ]
    }
  ]
}
