{
  "$schema": "../scripts/release-notes-schema.json",
  "version": "0.2.29",
  "date": "2026-05-29",
  "headline": "Show the real total before checkout and truthful stock on every product",
  "summary": "Two storefront truthfulness fixes. The cart and checkout now show the real total before payment — subtotal plus estimated tax, shipping, and any discount, all totalled — computed by the same engine that runs the actual charge, so the figure shown matches what will be charged (labelled estimated until an address narrows the tax and shipping, then exact; a destination with no matching rule reads 'calculated at checkout' rather than a wrong number). Cart lines also surface real stock state. On product pages, the buy box now reflects real per-variant inventory: an out-of-stock variant disables Add to cart with an honest message, and a low-stock variant shows 'Only N left'.",
  "sections": [
    {
      "heading": "Fixed",
      "items": [
        { "title": "The cart and checkout show your real total before you pay", "body": "Previously the cart total was just the subtotal and checkout showed no tax/shipping until the payment step. Both now render subtotal + estimated tax + estimated shipping + discount + total, computed from the same tax/shipping primitives as the Stripe charge — the displayed estimate equals the confirmed order total to the cent. Figures are labelled 'estimated' until a shipping address is entered (then exact); a destination with no matching tax or shipping rule reads 'calculated at checkout', and the subtotal stays honest. Cart lines now also show out-of-stock / low-stock state." },
        { "title": "Product availability reflects real inventory", "body": "The product buy box now reads real per-variant stock: an out-of-stock variant disables 'Add to cart' and shows an out-of-stock message (in the badge and the JSON-LD), and a variant at or below the configured low-stock threshold shows 'Only N left'. The add-to-cart control is no longer enabled for items that can't be bought." }
      ]
    }
  ]
}
