{
  "$schema": "../scripts/release-notes-schema.json",
  "version": "0.1.29",
  "date": "2026-05-26",
  "headline": "Category navigation goes live — public browse pages for the storefront's category tree, with breadcrumbs and sub-category grids",
  "summary": "The category tree now has a customer-facing surface. A new /categories index lists the active top-level categories as a card grid, and a new /categories/<slug> page renders a single category: its title and optional description, a breadcrumb chain from the catalog root down to the current category, and a grid of the category's direct child sub-categories. Each page reads fresh against the active tree, so archived or unpublished categories drop out of every surface. An unknown, archived, or malformed slug returns a 404, and a category with no children renders a graceful empty state. The pages are linked from the site footer's Shop column.",
  "sections": [
    {
      "heading": "Added",
      "items": [
        { "title": "Category index at /categories", "body": "A public page listing the active top-level categories as a card grid, each card carrying the category's title, optional description, and optional hero image, and linking into its browse page. Archived and unpublished categories are excluded. Linked from the site footer's Shop column." },
        { "title": "Category browse page at /categories/<slug>", "body": "A public page for a single category showing its title and optional description, a breadcrumb chain from the catalog root down to the current category (each ancestor linked, the current category shown as plain text), an optional hero image, and a card grid of the category's direct child sub-categories. A category with no children renders a graceful empty state. An unknown, archived, or malformed slug returns a 404." }
      ]
    }
  ]
}
