{
  "$schema": "../scripts/release-notes-schema.json",
  "version": "0.4.23",
  "date": "2026-06-06",
  "headline": "A stolen sign-in cookie stops working on another device, payment-provider outages fail fast and recover, replayed payment webhooks are refused, and the staff audit log is rewrite-evident",
  "summary": "A security-hardening release. The signed-in session cookie now carries a device fingerprint — a cookie lifted from one browser softly signs out instead of working anywhere for two weeks. Payment-provider calls run behind a circuit breaker, so a provider brown-out fails fast into the existing payment-unavailable page and recovers automatically instead of hanging every checkout. A captured payment-webhook payload can no longer be replayed inside the signature tolerance window. And the staff-activity audit log is anchored with post-quantum checkpoint signatures, with a verification endpoint that detects any rewrite of its history.",
  "sections": [
    {
      "heading": "Security",
      "items": [
        {
          "title": "The sign-in cookie is pinned to the device that signed in",
          "body": "The signed-in session cookie was tamper-proof but portable — exfiltrated once, it worked from any device until expiry. Signing in now embeds a fingerprint of the signing-in browser inside the sealed cookie, and every authenticated request re-checks it in constant time. A mismatch signs the visitor out gently to the sign-in page rather than failing the request mid-page; network changes don't trip it (the fingerprint deliberately excludes the IP address), and sessions issued before this release continue to work until they expire naturally."
        },
        {
          "title": "Payment-provider calls are circuit-broken and retried where safe",
          "body": "A payment-provider brown-out previously failed every checkout serially, each waiting out the full network timeout. Provider calls now run behind a circuit breaker: repeated failures trip it, subsequent checkouts fail fast into the existing payment-unavailable page, and the circuit closes again when the provider recovers. Idempotent calls — reads and writes carrying an idempotency key — retry through brief blips; non-idempotent calls never retry. The TLS configuration for provider connections is unchanged."
        },
        {
          "title": "Replayed payment webhooks are refused",
          "body": "A captured, validly-signed payment-webhook payload could be replayed within the signature timestamp tolerance and re-drive order transitions. Each event is now recorded on first receipt and a replay of the same event answers as an already-processed no-op — enforced with a single atomic write, so two concurrent deliveries of the same event also collapse to one. Replay records expire with the signature tolerance window."
        },
        {
          "title": "The staff audit log detects history rewrites",
          "body": "Staff-activity audit rows were hash-linked, which catches tampering with a single row but not a consistent rewrite of the whole chain. The chain is now anchored with periodic checkpoint signatures (ML-DSA, the same signing the framework audit chain uses), and `/admin/operators/audit/verify` reports both link integrity and checkpoint verification — a rewritten history fails the check. Stores that disable destructive operations behind a second approver were also evaluated: with one active operator the gate would deadlock the store, so gift-card voids, refunds, and operator disables remain single-approver — role-gated, bounded, reversible, and audited — with the stance and its revisit condition documented in the module."
        }
      ]
    }
  ]
}
