{
  "$schema": "../scripts/release-notes-schema.json",
  "version": "0.0.12",
  "date": "2026-05-20",
  "headline": "End-to-end checkout flow — shipping form, Stripe Elements, order confirmation",
  "summary": "Storefront completes the cart → checkout → pay → confirmation loop. The shipping form collects email + name + ISO 3166 country/state/postal, hands the values to `checkout.confirm`, persists the order in `pending`, and redirects to a Stripe Elements payment page with the per-order `client_secret`. After payment, Stripe redirects back to a server-rendered order confirmation page that shows status + lines + totals.",
  "sections": [
    {
      "heading": "Added",
      "items": [
        {
          "title": "Checkout flow routes",
          "body": "`lib/storefront.js` mounts `GET /checkout` (shipping form pre-filled with cart subtotal), `POST /checkout` (calls `checkout.confirm` with idempotency key + redirects to `/pay/:order_id` with a short-lived `shop_pay` cookie scoped Path=/pay/ + SameSite=Strict carrying the `client_secret`), `GET /pay/:order_id` (renders Stripe Elements payment page — loads Stripe.js from `js.stripe.com/v3/`, mounts the Payment Element, redirects to the order page on success via Stripe's `return_url`), and `GET /orders/:order_id` (server-rendered confirmation showing status, line items, and the subtotal/tax/shipping/total breakdown)."
        },
        {
          "title": "Wired through `server.js` when Stripe is configured",
          "body": "The storefront mount picks up `checkout` / `payment` / `order` / `tax` / `shipping` / `default_shipping_id` / `stripe_publishable_key` deps when `STRIPE_API_KEY` + `STRIPE_WEBHOOK_SECRET` are set. The default-fallback tax + shipping are zero-rate / zero-cost (operator-configured proper rules in `wrangler.toml` `[vars]` or a config primitive land later). Without Stripe configured, the storefront stays browseable (home / product / cart) but the checkout routes don't mount."
        },
        {
          "title": "Worker env passthrough",
          "body": "`worker/index.js` forwards `STRIPE_PUBLISHABLE_KEY` into the container env alongside the existing `STRIPE_API_KEY` + `STRIPE_WEBHOOK_SECRET` + `ADMIN_API_KEY` set."
        }
      ]
    },
    {
      "heading": "Detectors",
      "items": [
        {
          "title": "Layer 1 — storefront checkout renderers",
          "body": "`test/layer-1-state/storefront.test.js` gains `_checkoutForm` (form action + field shape + subtotal rendering), `_payPage` (Stripe.js loaded + pk + client_secret injected as JSON literals + total rendered + order id surfaced), and `_orderPage` (status + line + tax + total surfaced) tests. Six new assertion clusters."
        }
      ]
    }
  ]
}
