{
  "$schema": "../scripts/release-notes-schema.json",
  "version": "0.0.78",
  "date": "2026-05-23",
  "headline": "Edge HTML cache + SmartPlacement — unauthenticated storefront reads drop to ~10-30ms TTFB",
  "summary": "Two complementary perf wins layer on top of the v0.0.77 edge render. The Worker now wraps `/`, `/search`, and `/products/:slug` with a `caches.default` lookup keyed on the full request URL; only unauthenticated requests (no `shop_sid` / `shop_auth` cookie) are eligible. Cached responses carry `cache-control: public, max-age=60, stale-while-revalidate=300` so the edge keeps serving HTML while a background revalidate refreshes the data. Authenticated requests skip the cache entirely so per-session content stays correct. Separately, `wrangler.toml` gains `[placement] mode = \"smart\"` so the Worker compute runs close to D1 rather than close to the user — eliminates the cross-region D1 round-trip on cache miss.",
  "sections": [
    {
      "heading": "Added",
      "items": [
        { "title": "Edge HTML cache for unauthenticated storefront reads — 60s TTL + 300s stale-while-revalidate", "body": "`worker/index.js` wraps `_edgeRender` with a `caches.default` lookup. Requests carrying any `shop_sid` / `shop_auth` cookie bypass the cache and hit the renderer directly. Cache misses store the rendered HTML via `ctx.waitUntil(cache.put(...))` so subsequent visitors get an edge-cache hit at the same PoP. Stale-while-revalidate lets the edge serve last-known-good HTML during the 5-minute background-revalidate window. Cached responses carry an `x-edge-cache: hit` header for observability; misses carry `x-edge-cache: miss`." },
        { "title": "SmartPlacement enabled — Worker runs close to D1, not close to the user", "body": "`[placement] mode = \"smart\"` in `wrangler.toml`. Cloudflare's placement engine routes the Worker compute to a region close to the bound D1 database instead of the user-nearest PoP. The edge still serves the eventual response to the user via standard routing — only Worker execution moves. Cuts the D1 round-trip on cache miss from ~30-50ms (cross-region) to sub-ms (intra-region)." }
      ]
    }
  ]
}
