{
  "$schema": "../scripts/release-notes-schema.json",
  "version": "0.0.70",
  "date": "2026-05-22",
  "headline": "Six new primitives: click and collect, customer surveys, email templates, knowledge base, pixel events, sitemap generator",
  "summary": "Six primitives ship in one release covering store pickup (`clickAndCollect`), customer feedback (`customerSurveys`), operator-editable transactional email templates (`emailTemplates`), self-serve help center (`knowledgeBase`), server-side conversion pixel tracking (`pixelEvents`), and storefront sitemap generation (`sitemapGenerator`).",
  "sections": [
    {
      "heading": "Added",
      "items": [
        { "title": "`clickAndCollect` primitive — buy-online-pickup-in-store workflow", "body": "`bShop.clickAndCollect.create({ query?, order?, inventoryLocations?, notifications? })` returns `{ definePickupLocation, availableLocations, scheduleAtLocation, markReadyForPickup, markPickedUp, markNoShow, pickupsForLocation, customerSchedules }`. Five-state FSM: scheduled → ready → picked_up + no_show + cancelled terminals. Capacity gated on one-hour buckets; lead-time gate per location. `markReadyForPickup` enqueues a pickup-ready notification through the injected handle (drop-silent on failure so a notifications outage can't roll back the hold shelf). `markPickedUp` drives the parent order to delivered via `order.transition(id, 'mark_delivered')` (swallows fsm/illegal-transition for idempotency). Signature hashed via `namespaceHash('click-and-collect-signature', raw)`. Migration `0126_click_and_collect.sql`." },
        { "title": "`customerSurveys` primitive — post-purchase NPS / CSAT / CES surveys", "body": "`bShop.customerSurveys.create({ query? })` returns `{ defineSurvey, getSurvey, archiveSurvey, issueInvitation, getInvitation, invitationsForCustomer, submitResponse, responsesForSurvey, rollup, closeInvitation, cleanupExpired }`. Kinds: nps / csat / ces / custom. Trigger events: after_delivery / after_support_close / after_refund / manual. NPS / CSAT / CES enforce primary-question shape (`max === 10 / 5 / 7` respectively). NPS rollup = `round(%promoters - %detractors)`, CSAT = top-2-box positive_pct + mean, CES = mean + agree_pct. Invitation tokens 32-byte base64url plaintext returned exactly once, stored only as SHA3-512 namespaceHash. Migration `0128_customer_surveys.sql`." },
        { "title": "`emailTemplates` primitive — operator-editable transactional email templates", "body": "`bShop.emailTemplates.create({ query? })` returns `{ defineTemplate, getTemplate, listTemplates, updateTemplate, publishVersion, archiveTemplate, renderTemplate, versionsFor, validateVariables }`. Closed 11-kind enum (order_confirmation / order_shipped / order_delivered / order_refunded / password_reset / account_verification / abandoned_cart / wishlist_discount / review_request / welcome / generic). `{{var_name}}` substitution composes `b.template.escapeHtml`; `{{var_name|raw}}` slots require schema vouching at definition time. Locale fallback to `en`. Migration `0125_email_templates.sql`." },
        { "title": "`knowledgeBase` primitive — self-serve customer help center with search ranking", "body": "`bShop.knowledgeBase.create({ query?, defaultLocale?, cursorSecret? })` returns `{ defineArticle, getArticle, listArticles, updateArticle, publishArticle, unpublishArticle, archiveArticle, recordView, recordVote, voteAggregateForArticle, popularArticles, searchSuggest }`. Locale fallback chain. `searchSuggest` ranks by title 3 + tag 2 + body 1 weighted score; archived + unpublished excluded. Vote dedup at the `UNIQUE(slug, session_id_hash)` index. In-process markdown subset composes `b.template.escapeHtml` + `b.safeUrl.parse` (https-only + /-rooted internal). Session ids hashed via `namespaceHash` under `kb-view-session` / `kb-vote-session`. Migration `0162_knowledge_base.sql`." },
        { "title": "`pixelEvents` primitive — server-side conversion-tracking pixel / event API", "body": "`bShop.pixelEvents.create({ query? })` returns `{ registerProvider, recordEvent, dispatchTick, markDispatched, markFailed, eventsForOrder, dispatchedInPeriod, failedEvents, metricsForProvider }`. Provider enum: meta_capi / google_ec / tiktok_events / pinterest_capi / snap_capi. Event names: purchase / add_to_cart / view_content / lead / complete_registration / search. Customer email + phone SHA-256-hashed (per provider spec — NOT namespaceHash; ad platforms accept SHA-256 of the normalised value). Five-step retry back-off on transient failures. Migration `0123_pixel_events.sql`." },
        { "title": "`sitemapGenerator` primitive — storefront sitemap.xml + sitemap-index.xml", "body": "`bShop.sitemapGenerator.create({ query?, catalog?, collections?, storefrontPages?, custom? })` returns `{ defineSection, sections, archiveSection, validateOriginUrl, generate, recordGeneration, lastGeneration }`. Splits at 50,000 URLs or 50 MB serialized per chunk (whichever hits first). Path percent-encoding + XML escape on every emitted `<loc>`. Per-section sources: product / collection / storefront_page / custom. `validateOriginUrl` gates via `b.safeUrl` (https-only). Migration `0130_sitemap_generator.sql`." }
      ]
    }
  ]
}
