{
  "$schema": "../scripts/release-notes-schema.json",
  "version": "0.4.29",
  "date": "2026-06-11",
  "headline": "A gift card can no longer pay for two orders at once — credits debit before any charge — and store-credit wallets, capped discounts, and the gift-card audit chain all hold under concurrency",
  "summary": "A money-integrity release closing five concurrency windows, each reproduced before fixing. The serious one: gift-card and loyalty credits were debited after the order existed, with failures captured for reconciliation — so two simultaneous checkouts presenting the same gift card both produced paid orders while the card was only debited once. Credits now debit before any charge: the database balance gate decides the race, the loser gets a clean re-quote, and a checkout that fails after the debit but before the order exists reverses the debit automatically. Store-credit wallets stop computing balances from a stale read — concurrent debits can no longer overdraw, and two grants landing in the same millisecond both count. Capped automatic discounts are reserved atomically before charging, so a last-redemption race refuses one buyer with a clear message instead of granting both. Every gift-card ledger entry — debits included — now participates in the per-card tamper-evidence hash chain, a uniqueness fence keeps concurrent writes from forking it, and a new verifyChain call recomputes a card's chain on demand. The payment idempotency cache absorbs same-key races instead of failing one of them. Upgrade applies two D1 migrations.",
  "sections": [
    {
      "heading": "Security",
      "items": [
        {
          "title": "Gift-card and loyalty credits debit before any charge",
          "body": "A checkout's gift-card and loyalty debits are now the first money movement, ahead of the payment intent and the order row, on the card-payment and PayPal paths alike. The database balance predicate is the cross-checkout double-spend gate: two carts presenting the same card race it directly, exactly one wins, and the loser's checkout rolls back cleanly — stock holds released, cart reusable, a clear message and re-quote, nothing charged. A checkout that dies between the debit and order creation reverses the debit (claim-guarded, exactly once). Once the order exists the debit is attached to it, so refunds and cancellations keep reversing credit proportionally exactly as before."
        },
        {
          "title": "Every gift-card ledger entry is chained, and the chain can't fork",
          "body": "Debit rows — previously written outside the hash chain by the atomic overdraft guard — now carry the same parent and row hashes as credits and expirations, with the overdraft gate still enforced inside the insert. A per-card uniqueness fence (one child per chain tip) makes concurrent writes serialize instead of forking the chain or basing a balance on a stale snapshot; a writer that loses the race re-reads the tip and retries. A new verifyChain call recomputes a card's chain end to end and reports the first divergence, tolerating rows that predate the chain columns as a counted, unverifiable prefix."
        }
      ]
    },
    {
      "heading": "Fixed",
      "items": [
        {
          "title": "Store-credit wallets hold under concurrent writes",
          "body": "Wallet writes computed the new balance from a separately-read snapshot, so two concurrent debits could both fulfill against one balance — overdrawing the wallet — and two grants landing in the same millisecond could tie on their timestamp and silently drop one. Every wallet write now computes the live balance and a strictly-monotonic per-customer timestamp inside a single guarded insert: a debit that loses the race is refused as insufficient, both same-instant grants land and sum, and the scheduled expiry sweep keeps its degrade-gracefully cap."
        },
        {
          "title": "Capped automatic discounts are reserved before charging",
          "body": "A rule's redemption caps were only read at quote time and counted after the order existed, so a single-use discount applied to every order that raced the last redemption. The applied rules are now claimed atomically before any charge — total cap and per-customer cap both enforced inside single guarded statements — and a refused claim fails the checkout closed with a clear message and re-quote, never a silently different price. A checkout that fails before its order exists releases its reservations, recording a redemption is idempotent per order, and a retried checkout reuses its own claim instead of double-reserving."
        },
        {
          "title": "Same-key payment calls absorb their race",
          "body": "Two concurrent calls carrying the same idempotency key could both miss the replay cache and collide on its primary key, failing one of them with a constraint error. The cache claim is now conflict-aware: one call stores its response, the other defers to it and replays — and a same-key call carrying a different request body is still refused as a collision, racing or not."
        }
      ]
    }
  ]
}
